{
  "schema_version": 1,
  "artifact_kind": "records-deletion-receipt",
  "receipt_id": "purge-01",
  "policy_id": "conservative-default",
  "policy_sha256": "aaaaaaaaaaaaaaaaaaaaaaaaaaaaaaaaaaaaaaaaaaaaaaaaaaaaaaaaaaaaaaaa",
  "hold_envelope_id": "0123456789abcdef0123456789abcdef",
  "records_officer": "records-officer-01",
  "target_root_hash": "bbbbbbbbbbbbbbbbbbbbbbbbbbbbbbbbbbbbbbbbbbbbbbbbbbbbbbbbbbbbbbbb",
  "as_of": "2026-08-22T12:00:00Z",
  "selected_classes": ["memory"],
  "deleted_records": [
    {
      "record_id": "rec_0123456789abcdef0123456789abcdef",
      "artifact_class": "memory",
      "path": ".agent/memory/working/WORKSPACE.md",
      "content_sha256": "cccccccccccccccccccccccccccccccccccccccccccccccccccccccccccccccc",
      "expired_at": "2026-08-21T12:00:00Z",
      "disposition": "deleted"
    }
  ],
  "export_performed": true,
  "export_manifest_sha256": "dddddddddddddddddddddddddddddddddddddddddddddddddddddddddddddddd",
  "sensitivity": "metadata-only",
  "purpose": "records-deletion-evidence",
  "audience": ["operators", "auditors"],
  "retention_class": "organization-policy-required",
  "content_policy": "identifiers-and-relative-paths-only",
  "raw_content_stored": false,
  "transactionally_bound": true
}
